,text,cossim
731,too expensive for low income students,0.5773502691896257
724,"strange but true. : as long as you pay more than 50% of your mom’s expenses, you can claim her a a dependent.",0.4472135954999579
200,i'm -1500 sai as well and cal poly slo was more expensive than every uc for me.,0.4472135954999579
3128,take purdue. berkeley so much more expensive,0.4472135954999579
658,"i would pick cornell if you're set on studying econ. it's more expensive overall, but if you're parents cover tuition, i can't see living expenses be more expensive in ithaca than socal.

if you're not set on econ i'd pick gt, but it seems you're not a huge fan of pure cs.",0.4423258684646914
195,"unless your family won't feel the extra $160k expense, then gt.",0.408248290463863
1742,"so brown is significantly more expensive? otherwise, i’d say go with brown.",0.3779644730092272
422,"binghamton or purdue, depending on how much your family will ""feel"" that additional expense.  if it would be a burden, then bing.",0.35355339059327373
3727,i would choose duke but honestly it might be expensive depending on your major,0.35355339059327373
276,this is what they want for you and you will be in a position to help them out later. if he has medical expenses maybe you can leverage that to get some aid.,0.35355339059327373
2509,"go to a college with a better overall ranking, considered very good in your course, less expensive, and further away from internship opportunities

or

a college with a high ranking in your course, but relatively unknown otherwise, much more expensive, and incredible location for opportunities",0.3481553119113957
1441,"it’s not really the case that mit students are only interested in the one thing they’re studying.

unless columbia’s way less expensive, i’d opt for mit.",0.30151134457776363
3807,"i terms of college applications, even at “only” $3k, it’s still an expensive summer camp experience for people with more money than good sense.",0.30151134457776363
481,"i would go to whichever one is less expensive. when you apply for phd programs they will all be free, so you can accept an offer from whichever school has research that you’re most interested in.",0.2886751345948128
2009,"if it’s stanford - it could be justified. i see some people referring to uiuc as a t5 for cs (which it isn’t), and in no way would that school or a similar one be worth that incredible expense.",0.2886751345948128
2894,"more and more donors to expensive private colleges are not paying.  you don’t always get what you pay for. 
state colleges are funded by resident tax and government. it’s very sustainable.",0.2773500981126146
2146,"huh.  i learned that college is expensive for most everyone, and results are unpredictable. so i told my daughter to get a jump start on that “work/life balance” thing that is still hard for even adults to figure out….",0.26726124191242434
910,"i’m not sure what the question is? if you qualify for the blue and gold plan you won’t pay tuition. you may have to cover some or all of your living expenses.

all phd students at berkeley are fully funded i believe.",0.26726124191242434
2840,money definitely matters. i talked to a bunch of other admitted students and so many of them openly claim how their expensive private counselors wrote their essays and made their profile.,0.25819888974716115
2789,"money matters everywhere in life.

even if you do manage to be accepted into an expensive school, it’s an uphill battle to socialize with those who have little in common wealth-wise. not impossible, but something to consider",0.25819888974716115
2713,"assuming purdue is significantly less expensive than what it would cost you to attend case, i would pick purdue.",0.25
2428,seriously make sure you want to be a lawyer before you take out massive debt with mixed results in terms of being able to pay it off. it's not a glamorous or exciting job and it is very expensive with a shrinking number of high paying jobs.,0.25
2003,"if you like them all equally, then, not usc since it's the most expensive and doesn't offer any advantages over the others.

at both cornell and washu you can likely switch between bio and chemistry pretty easily, so that's not a problem.

between cornell and washu, washu is markedly more popular among students who intend to apply to medical school.  whether that preference is actually **rational** is another question, though.

probably the most straightforward choice here, though, is washu.  least expensive + among the set of schools usually considered ""good for pre-med"".",0.2480694691784169
1916,"if washington is significantly less expensive, then washington, unless your family really wouldn't feel the cost difference at all.  in that case, pick your favorite.",0.24253562503633297
1116,"i don’t know who told you that the area around the university of washington is unsafe, but that person should stop watching fox news and oan. it’s a fine neighborhood with a lot of nice amenities. the residential areas that surround it are expensive.",0.22941573387056177
140,"intended major: life science / health science 

mcgill university (joint major biology and computer science)

- love the campus 
- closer to home, but will probably commute :/
- much cheaper tuition 
- adore mcgill’s social life 

utsc (life sciences co-op) or utm (life science)

- received $1500 scholarship for utsc
- better ranking 
- farther away from home + need to live on res
- $$$ expensive

ubc vancouver (life science) 

- gorgeous campus!!!
- beautiful weather 
- expensive :( 
- far from home",0.22645540682891913
725,"i suggest applying to a wide range of schools and letting the aos decide. unless it’s too expensive, don’t not apply because you think you know that the decision will be. perhaps consider sone liberal arts colleges like milsaps.",0.22360679774997896
1999,"i would avoid usc cause it's a more dangerous area, less prestigious, and more expensive it seems too. if you like a college town then go to cornell, if you want a more resourceful city then washu. congrats on some great choices!",0.22360679774997896
2929,"get a really stellar test score.  all private colleges are super expensive, unless you qualify for fin aid.  take a close look at the 4 yr state colleges in-state for you, also your flagship state u.",0.21320071635561041
4104,"honestly, it doesn't matter bc nyu is expensive af. plus, college decisions are like a lottery. one of my friends had like a 36 act, 5s on 12 aps, did research on some physics stuff, and won multiple awards and he didnt get anywhere accept for our state school, which is not that good.",0.21320071635561041
3208,"saving $240,000 and being happier to boot? seems like maryland is the obvious call 

hopefully strict will drop is roi copypasta, but if he doesn’t, go walk around some expensive stores and do some mental math. very few 18 year olds can actually wrap their minds under how much money that actually is",0.21320071635561041
1023,"this is an extremely drastic shift in interest, and it is likely that you won’t stay in the premed track once you realize the differences in classes. that being said, if you do stick to premed, you want to go to the cheapest option since med school is extremely expensive",0.20851441405707477
2102,why are public schools so expensive for me? it would cost at a minimum 12k a year to attend my state flagship taking out loans and doing work study and same for other oos public schools i got into but only 3k a year for cornell and princeton. ,0.20000000000000004
1522,"you get brainwashed that the only way to be successful is to go to to a t20, but assuming you get no scholarship offers, is it worth 80k a year for 4 years in student debt? or maybe you have parents with crazy jobs, idk?   


i saw this post on linkedin about a madagascar guy who got into upenn, but literally can't go because its so expensive and visa stuff. just made me wonder how many others out there fall through the cracks?",0.19999999999999998
182,"i see people constantly say that cal states are a good choice for low income students, but that couldn’t be farther from the truth. 

uc has very deep pockets and are able to make on campus dorms and tuition almost free for poor students, and even if you’re in the lower middle, you are at least guaranteed free tuition if you make under $80k per year. most cal states will give you just what you’re owed (pell + cal grant) and nothing more. that covers tuition but you’re on your own for living expenses. 

as a -1500 sai student, here are my cost differences (after all normal fafsa grants and aid are applied) for each school, and that all include tuition + room and board:

cal poly slo: $5,019

ucla: -$36 (i am literally being paid $36 to attend)

csulb: $8,605



i am very glad i pushed myself to submit a uc application, as i was almost convinced by this myth that a uc would be much more expensive, when in fact, it is my cheapest option. 

",0.1970658556328586
3665,"depends on what you mean by stem (engineering vs. physics or math) and also cost.

if i planned to study engineering and work in the us:  ivy.

if the ivy were much less expensive:  ivy.

if i wasn't sure about which course of study i wanted to pursue:  ivy.

in every other situation:  oxbridge.",0.19611613513818404
596,"they keep pushing all these articles with interviews of the admissions departments for these expensive private schools stating how “no one pays full price” all while in the next sentence saying how roughly 33% do….

and i’ve read a bunch of posts from people like you who say they will if they chose to attend 

it’s so hard to justify nearly or upwards of 400k for undergrad regardless of where you go",0.19611613513818402
397,"ok hate to break it to you but the umiami dorms aren’t that great either unless you’re willing to dish out for the more expensive housing options. also rent in miami is god damn crazy so off campus isn’t that much better (boston is the same tbh) 
as someone who lived by umiami and is now in boston, it actually may fully depend on what the campus feel you’re after as they are incredibly different. i can also guarantee that umiami won’t be what you think it is. it may look nice but it’s going to be a lot underwhelming than you think. it depends on your social priorities tbh. of course this is without taking into consideration financials, both will be incredibly expensive (even umiami full ride because miami is not cheap as a city) so if financials isn’t so high on your list i would consider thinking more about the social and academic aspects",0.19245008972987526
3219,"remember that life doesn't end at undergrad. that money saved can afford you even the most expensive elite masters programs if you decide you want to enter an industry/field where prestige matters.

not to mention thst if you invest it in the us stock market, historically it has grown by roughly 6x-36x times over 4 decades in real terms with dividends reinvested. you're capable of doing the math.",0.19245008972987523
2368,"wrote an essay for uchicago on superheroes and it was so fun. i genuinely like writing, btw. did put actual effort on that but didn't get in. fair though, i'm not like an ideal 4.0 applicant or anything, this was just for shits and giggles in case ""oh wow i actually got in"". plus it would also be pretty expensive.",0.19245008972987523
2728,my friend wants to study computational physics so he wants to major in ece and also take applied physics classes. he is an international student and got into berkeley (not eecs) and purdue for engineering. berkeley is significantly more expensive and what exactly would he get by paying more?,0.18257418583505539
1740,"both are great options but everyone from harvard in banking or consulting just moves to new york anyways. you wouldn’t have any problem whatsoever networking or doing summer internships in nyc. getting to go to school in the city is great too, but it’s really really expensive and nyc is much more fun later on once you’re making money imo.",0.18257418583505536
3889,"mich is the easy one out. nothing special at all in regards to premed programming and expensive for your family.

*if* your family very comfortably has the money for rice, there’s an argument to be made there. if your family doesn’t and any premium paid in undergrad would make med school far less affordable, then uva is a great school at the end of the day and the safe bet.",0.17960530202677488
352,"i'm so sorry, but you're probably not very competitive for the us schools you've listed. it might be worth taking a shot, but i think admission is below unlikely. on the other hand, the european universities sound realistic. you might want to get those predicts up, but (maybe except for eth zurich) you should be fine. remember about language requirements and cost of living, studying in europe is much more expensive than just tuition. good luck!!",0.17677669529663687
2034,"hi, i've applied to over 10 universities in america and got into 8 of them but it turns out i can't afford any of them :/ so now i'm looking for universities in europe but i'm aware that most deadlines are far past, but i know that there are still some countries in europe with late deadlines and i'm hoping this subreddit can give me any university recommendations anywhere in europe or even asia that fits these criteria:

high-quality education

major could be any of the following: mechanical engineering, computational science, mechatronics/robotics, or even graphic design.

it needs to be taught in english and doesn't need any other language diploma.

i can afford up to 25,000 dollars per year all expenses included max 30,000 (but i don't think universities in europe or asia cost this expensive anyway)

since i am queer, i would prefer a safe environment where i could express myself. so, i would prefer a more ""free-thinking"", left-leaning student body. maybe even queer bars

and yeah, i think that's about it. if you think you could help me, please do since i'm currently under a lot of pressure, thank you.",0.17474081133220762
1797,"hello everyone.

this past month i have been extremely lucky and grateful to have been accepted as a questbridge college prep scholar and as a leda finalist (not actually accepted yet, still need to schedule interview). the downside, however, is that i just learned i can only do one, as cps and leda are very similar programs. as a very clueless student, i have no clue which to pick, and some advice would be greatly appreciated. here's some pros and cons off the top of my head:

leda  
pros:

* all expenses paid summer camp at princeton or yale (very very exciting)
* does... something? stuff?

cons:

* haven't done interview yet =&gt; might not get in
* extremely unclear what exactly the program accomplishes
* cannot do qb

questbridge college prep scholar:  
pros:

* already accepted
* 6x more likely to get into national college match
* college admissions conference at rice
* does something i think

cons:

* also very unclear what the program does
* admissions conference is short, not paid for (gas and hotel is very expensive), and is not particularly exciting
* cannot do leda

if anyone has esoteric arcane knowledge, or knows the weight of the pros and cons better than i do, pretty please weigh in because it's stressful. vielen dank!!",0.173421993904824
388,"is the full ride based on financial need, or is it non-need-based?

if the ivies are going to end up costing a lot more, then i'd strongly consider the school where your cost is guaranteed to be zero.

on the other hand, if your parents' income is only barely above 100k, then you may still be paying very little to attend the ivy schools.  if that's the case, then it might be worth the expense.  for the experience, not because it'll necessarily improve your odds of being admitted to medical school.",0.16666666666666666
3189,ucsb is top 10 in cheme. also regarded as a better school compared to your other choices. better quality of life than your other choices. isla vista also has a good music scene. seems like an easy choice unless it’s much more expensive than your other choices.,0.16222142113076254
393,"man my country focuses only on academics and nothing else. there are basically no viable opportunities for extra curriculars in my country that are non - academic based. 
i'm writing a book that i should be able to publish by the end of this year and i'll start volunteering this year as well but thats basically all the ecs i can get.
even ap tests and classes are wayyy to expensive in my country. idek what to do.",0.16222142113076254
2836,i’m a junior in highschool and want to go to a women’s college. i looked at smith college and kinda fell in love but i don’t think i have good enough grades to get in as i have a 3.5 gpa. what can i do to make my chances of getting accepted better? or what are some good women’s colleges that i have a better chance of getting into that are similar to smith and aren’t super expensive?,0.16012815380508713
2763," 

so i am currently in final year of my high school and i am looking for bachelor's course in pharmacy. what are some great colleges to pursue the course in medicine? what kind off test like sat or ilets should i give to be eligible for those universities.

i am not from a very privileged family too so i guess the expense for 4 years course should be around 70 lakhs to 80 lakhs or 100k us dollars approximately. so are there any scholarship opportunity ?",0.16012815380508713
1165,"unless you just really want the open curriculum at brown (which, as a cheme major, you may not be able to take full advantage of) i'd pick rice.  less expensive, better for cheme, still gives you the ability to easily switch between majors, and there are lots of cheme jobs in houston.

without having looked into it too deeply, brown's program may also have a different focus than rice's.  from 2008 to 2019 it was accredited as ""chemical and biochemical engineering"" before re-accrediting as ""chemical engineering"" in 2020.",0.1543033499620919
1938,"premed from middle class family (100-150k) household income. need help choosing between 30k a year for tulane vs state “flagship” around 5-10k a year (barely nationally ranked). might need to take out loans for tulane, likely around 10-20k a year. medical school debt is really putting me off from loans and such an expensive school. 
thoughts?",0.1524985703326047
1679,"overall, yes, your chances of very good financial aid are fucked if your family is high income.  

merit aid is not tied to income, so if you are a top notch student and applying to colleges that are thirsty for you, you may do very well.  

on your side note, no, it won't work.  possibly if you went though the process of becoming an emancipated minor but that's not easy.  it requires your parents' consent and you also need to have a legal income that is sufficient to cover all your expenses. rent, food, clothing, transportation, insurance, healthcare, phone and of course your college tuition.",0.15249857033260467
630,"title. i'm premed, and i thought case western would be better, but my parents are adamant and cwru is too expensive. im also not honors college. help me love umich are there any aspects about it please any help is appreciated 😭

edit: i'm really in a bad place right now after arguing with parents, please be nice and give genuine help and support.",0.15249857033260464
970," hello! incoming freshman looking for help choosing between these two universities &gt;-&lt;

intended major: electrical and information engineering (imperial), mechanical engineering (uva)

**uva**

uva pros:

* in the us (i plan to work in the us in the future)
* more well-known in the us?
* able to make wider social connections
* opportunity to go to darden (top 10 in us?)
* more student life
* more manageable curriculum, easier to get a good gpa
* more recognized in the us when applying for grad school in the us?

uva cons:

* globally lower-ranked than imperial
* weaker academics
* more expensive school fees (though less expensive cost of living)
* located in an area further from the city, less opportunities?

**imperial**

imperial pros:

* stronger academics, stronger technical foundation
* more recognized globally for engineering
* city area: more convenient for london internships and daily living overall

imperial cons:

* less social connections
* harder curriculum, harder to get a good gpa
* less recognized than a us undergrad when applying for grad school in the us?
* holidays do not match up with us, harder to apply for us internships

&amp;#x200b;

some other questions i have:

\- is it true that employers in us favor uva over icl? 

\- do us employers recognize uk internships? or would they prefer us internships?",0.15205718425394107
2667,"if you plan to apply to u.s. law schools then, imo, none of these are ""better"" than any of the others.  if you've already been admitted to the law course at king's, then, assuming your plans include law school in the u.s., i wouldn't choose king's (unless you can switch to a different course, but iirc that isn't possible).  however, if you want a career in law in the uk then definitely go to king's.

between vassar and mcgill, with the goal of attending a u.s. law school, i suspect neither is better than the other.  given mcgill is less expensive and you like various things about it (location, french, etc.), mcgill seems like a strong contender.",0.15075567228888181
521,"(chem - pre med) - georgetown is obviously significantly more expensive but it has significant better opportunities in dc and a higher med school acceptance rate. am i making a bad decision choosing georgetown? 

i also went to a rural highschool and im worried the classes might be too difficult for what i can keep up with. would it be better to be someone who performs better at uk? 

i am just really struggling with making a bad decision? ",0.14907119849998599
3516,"my 15 year old made $3k babysitting over the summer. if you can go to u of m for the equivalent of babysitting money, yeah, do it.

only thing i want to know: what is your transportation situation? do you have a car? you don’t need one for on campus living but, how do you plan to make the 10 hour trip to and from the school to home? 

so it sounds like they are covering full tuition and most of room and board. does that continue beyond freshman year? do you have to live in an apartment or in dorms after freshman year? that to me is the only wild card in the cost piece, your living expenses after freshman year.",0.14586499149789456
354,"go with your gut and go with umiami! tbh i'm not impressed by people that go to harvard anymore, it's one of the most overrated ivies that doesn't really merit the prestige i think. i think the other ivies are way better than harvard. i also got into umiami as a transfer, and they really wanted to me attend and and were so welcoming.  i wanted to attend but it was too expensive so i didn't go. but if you have a full-ride it's totally worth it.",0.14285714285714285
3236,"i wager they're all about the same in terms of your odds of being accepted as a transfer student to the schools you list.  i'd either pick:

* the one that's least expensive (since you plan to transfer anyway), or
* the one you'd most enjoy attending for a year (since you plan to transfer anyway), or
* the one you'd most like to have a degree from (in case your transfer plans don't work out).",0.14142135623730953
